{
  "schemaVersion": 1,
  "id": "math-l03",
  "module": "MATHEMATICS",
  "levelNumber": 3,
  "title": "Cohete cuentaestrellas",
  "status": "PUBLISHED",
  "activities": [
    {
      "id": "math-l03-a01",
      "type": "visual_count",
      "instruction": "Para encender el cohete necesitas contar 8 manzanas-combustible.",
      "payload": { "items": [{ "kind": "emoji", "value": "apple", "count": 8 }], "options": [6, 7, 8, 9] },
      "answer": { "value": 8 },
      "feedback": { "correct": "Despegue listo: contaste 8.", "incorrect": "Cuenta cada manzana antes del despegue." },
      "reward": { "xp": 15, "stars": 12 },
      "accessibility": { "spokenInstruction": true, "altText": "Ocho manzanas como combustible de cohete" }
    },
    {
      "id": "math-l03-a02",
      "type": "visual_count",
      "instruction": "El robot de la luna encontró 9 manzanas espaciales. ¿Cuál número es?",
      "payload": { "items": [{ "kind": "emoji", "value": "apple", "count": 9 }], "options": [7, 8, 9, 10] },
      "answer": { "value": 9 },
      "feedback": { "correct": "Correcto, son 9 manzanas espaciales.", "incorrect": "Cuenta en voz alta hasta llegar al final." },
      "reward": { "xp": 15, "stars": 12 },
      "accessibility": { "spokenInstruction": true, "altText": "Nueve manzanas espaciales" }
    },
    {
      "id": "math-l03-a03",
      "type": "visual_count",
      "instruction": "La nave necesita 10 manzanas para volver a casa. Encuentra el 10.",
      "payload": { "items": [{ "kind": "emoji", "value": "apple", "count": 10 }], "options": [8, 9, 10, 11] },
      "answer": { "value": 10 },
      "feedback": { "correct": "Perfecto, 10 completa la misión.", "incorrect": "Haz grupos pequeños y vuelve a contar." },
      "reward": { "xp": 18, "stars": 15 },
      "accessibility": { "spokenInstruction": true, "altText": "Diez manzanas para una nave" }
    }
  ]
}
