{
  "schemaVersion": 1,
  "id": "logic-l03",
  "module": "LOGIC",
  "levelNumber": 3,
  "title": "La cueva de patrones rotos",
  "status": "PUBLISHED",
  "activities": [
    {
      "id": "logic-l03-a01",
      "type": "pattern_completion",
      "instruction": "Completa las antorchas de la cueva.",
      "payload": {
        "scene": "El patron es fuego, agua, fuego, agua.",
        "sequence": [
          "fire",
          "water",
          "fire",
          "water",
          "?"
        ],
        "options": [
          "fire",
          "water",
          "earth",
          "air"
        ],
        "display": {
          "1": "1",
          "2": "2",
          "3": "3",
          "4": "4",
          "5": "5",
          "6": "6",
          "7": "7",
          "8": "8",
          "9": "9",
          "10": "10",
          "red": "??",
          "yellow": "??",
          "blue": "??",
          "green": "??",
          "A": "A",
          "B": "B",
          "C": "C",
          "E": "E",
          "I": "I",
          "O": "O",
          "U": "U",
          "ma": "ma",
          "pa": "pa",
          "la": "la",
          "sa": "sa",
          "small": "S",
          "medium": "M",
          "large": "L",
          "north": "??",
          "east": "??",
          "light": "?",
          "dark": "?",
          "fire": "??",
          "water": "??",
          "soft": "?",
          "strong": "??"
        },
        "hint": "Identifica el bloque que se repite."
      },
      "answer": {
        "value": "fire"
      },
      "feedback": {
        "correct": "Patron completado.",
        "incorrect": "Mira el orden desde el inicio y busca repeticion."
      },
      "reward": {
        "xp": 14,
        "stars": 12
      },
      "accessibility": {
        "spokenInstruction": true,
        "altText": "Patron interactivo"
      }
    },
    {
      "id": "logic-l03-a02",
      "type": "memory_pairs",
      "instruction": "Recuerda gemas iguales en la oscuridad.",
      "payload": {
        "scene": "Las gemas brillan por un segundo.",
        "pairs": [
          "gem",
          "star",
          "heart"
        ],
        "symbols": {
          "gem": "??",
          "star": "?",
          "heart": "??"
        }
      },
      "answer": {
        "pairs": 3
      },
      "feedback": {
        "correct": "Encontraste todos los pares.",
        "incorrect": "Memoriza posicion y simbolo antes de tocar otra carta."
      },
      "reward": {
        "xp": 18,
        "stars": 15
      },
      "accessibility": {
        "spokenInstruction": true,
        "altText": "Memoria de pares"
      }
    },
    {
      "id": "logic-l03-a03",
      "type": "multiple_choice",
      "instruction": "Elige la conclusion correcta.",
      "payload": {
        "scene": "Todos los buhos vuelan. Oli es un buho.",
        "question": "Que puede hacer Oli?",
        "hint": "Une buho con vuelan.",
        "options": [
          "volar",
          "nadar",
          "pintar",
          "cocinar"
        ]
      },
      "answer": {
        "value": "volar"
      },
      "feedback": {
        "correct": "Respuesta correcta. Usaste la pista, no solo memoria.",
        "incorrect": "Relee la pista y descarta opciones imposibles."
      },
      "reward": {
        "xp": 13,
        "stars": 11
      },
      "accessibility": {
        "spokenInstruction": true,
        "altText": "Que puede hacer Oli?"
      }
    },
    {
      "id": "logic-l03-a04",
      "type": "pattern_completion",
      "instruction": "Completa la serie de tamanos.",
      "payload": {
        "scene": "La serie crece y vuelve a empezar.",
        "sequence": [
          "small",
          "medium",
          "large",
          "small",
          "?"
        ],
        "options": [
          "small",
          "medium",
          "large",
          "huge"
        ],
        "display": {
          "1": "1",
          "2": "2",
          "3": "3",
          "4": "4",
          "5": "5",
          "6": "6",
          "7": "7",
          "8": "8",
          "9": "9",
          "10": "10",
          "red": "??",
          "yellow": "??",
          "blue": "??",
          "green": "??",
          "A": "A",
          "B": "B",
          "C": "C",
          "E": "E",
          "I": "I",
          "O": "O",
          "U": "U",
          "ma": "ma",
          "pa": "pa",
          "la": "la",
          "sa": "sa",
          "small": "S",
          "medium": "M",
          "large": "L",
          "north": "??",
          "east": "??",
          "light": "?",
          "dark": "?",
          "fire": "??",
          "water": "??",
          "soft": "?",
          "strong": "??",
          "huge": "XL"
        },
        "hint": "Mira el ciclo S-M-L."
      },
      "answer": {
        "value": "medium"
      },
      "feedback": {
        "correct": "Patron completado.",
        "incorrect": "Mira el orden desde el inicio y busca repeticion."
      },
      "reward": {
        "xp": 14,
        "stars": 12
      },
      "accessibility": {
        "spokenInstruction": true,
        "altText": "Patron interactivo"
      }
    }
  ]
}
