{
  "schemaVersion": 1,
  "id": "logic-l05",
  "module": "LOGIC",
  "levelNumber": 5,
  "title": "Archivo secreto de Tiko",
  "status": "PUBLISHED",
  "activities": [
    {
      "id": "logic-l05-a01",
      "type": "pattern_completion",
      "instruction": "Completa el codigo del archivo.",
      "payload": {
        "scene": "El codigo repite rojo, amarillo, verde.",
        "sequence": [
          "red",
          "yellow",
          "green",
          "red",
          "yellow",
          "?"
        ],
        "options": [
          "green",
          "red",
          "blue",
          "yellow"
        ],
        "display": {
          "1": "1",
          "2": "2",
          "3": "3",
          "4": "4",
          "5": "5",
          "6": "6",
          "7": "7",
          "8": "8",
          "9": "9",
          "10": "10",
          "red": "??",
          "yellow": "??",
          "blue": "??",
          "green": "??",
          "A": "A",
          "B": "B",
          "C": "C",
          "E": "E",
          "I": "I",
          "O": "O",
          "U": "U",
          "ma": "ma",
          "pa": "pa",
          "la": "la",
          "sa": "sa",
          "small": "S",
          "medium": "M",
          "large": "L",
          "north": "??",
          "east": "??",
          "light": "?",
          "dark": "?",
          "fire": "??",
          "water": "??",
          "soft": "?",
          "strong": "??"
        },
        "hint": "El bloque es rojo-amarillo-verde."
      },
      "answer": {
        "value": "green"
      },
      "feedback": {
        "correct": "Patron completado.",
        "incorrect": "Mira el orden desde el inicio y busca repeticion."
      },
      "reward": {
        "xp": 14,
        "stars": 12
      },
      "accessibility": {
        "spokenInstruction": true,
        "altText": "Patron interactivo"
      }
    },
    {
      "id": "logic-l05-a02",
      "type": "multiple_choice",
      "instruction": "Deduce que caja pesa mas.",
      "payload": {
        "scene": "Caja A pesa mas que B. Caja B pesa mas que C.",
        "question": "Cual pesa mas?",
        "hint": "Sigue la cadena de comparaciones.",
        "options": [
          "A",
          "B",
          "C"
        ]
      },
      "answer": {
        "value": "A"
      },
      "feedback": {
        "correct": "Respuesta correcta. Usaste la pista, no solo memoria.",
        "incorrect": "Relee la pista y descarta opciones imposibles."
      },
      "reward": {
        "xp": 13,
        "stars": 11
      },
      "accessibility": {
        "spokenInstruction": true,
        "altText": "Cual pesa mas?"
      }
    },
    {
      "id": "logic-l05-a03",
      "type": "memory_pairs",
      "instruction": "Memoriza simbolos del archivo.",
      "payload": {
        "scene": "El archivo usa simbolos parecidos.",
        "pairs": [
          "key",
          "map",
          "lock",
          "gem"
        ],
        "symbols": {
          "key": "??",
          "map": "???",
          "lock": "??",
          "gem": "??"
        }
      },
      "answer": {
        "pairs": 4
      },
      "feedback": {
        "correct": "Encontraste todos los pares.",
        "incorrect": "Memoriza posicion y simbolo antes de tocar otra carta."
      },
      "reward": {
        "xp": 19,
        "stars": 16
      },
      "accessibility": {
        "spokenInstruction": true,
        "altText": "Memoria de pares"
      }
    },
    {
      "id": "logic-l05-a04",
      "type": "multiple_choice",
      "instruction": "Elige la herramienta para la mision.",
      "payload": {
        "scene": "Necesitas cortar una cuerda.",
        "question": "Que herramienta conviene?",
        "hint": "Piensa en la funcion.",
        "options": [
          "tijera",
          "vaso",
          "almohada",
          "sol"
        ]
      },
      "answer": {
        "value": "tijera"
      },
      "feedback": {
        "correct": "Respuesta correcta. Usaste la pista, no solo memoria.",
        "incorrect": "Relee la pista y descarta opciones imposibles."
      },
      "reward": {
        "xp": 13,
        "stars": 11
      },
      "accessibility": {
        "spokenInstruction": true,
        "altText": "Que herramienta conviene?"
      }
    },
    {
      "id": "logic-l05-a05",
      "type": "pattern_completion",
      "instruction": "Completa el semaforo logico.",
      "payload": {
        "scene": "El semaforo va rojo, amarillo, verde.",
        "sequence": [
          "red",
          "yellow",
          "green",
          "red",
          "?"
        ],
        "options": [
          "yellow",
          "green",
          "red",
          "blue"
        ],
        "display": {
          "1": "1",
          "2": "2",
          "3": "3",
          "4": "4",
          "5": "5",
          "6": "6",
          "7": "7",
          "8": "8",
          "9": "9",
          "10": "10",
          "red": "??",
          "yellow": "??",
          "blue": "??",
          "green": "??",
          "A": "A",
          "B": "B",
          "C": "C",
          "E": "E",
          "I": "I",
          "O": "O",
          "U": "U",
          "ma": "ma",
          "pa": "pa",
          "la": "la",
          "sa": "sa",
          "small": "S",
          "medium": "M",
          "large": "L",
          "north": "??",
          "east": "??",
          "light": "?",
          "dark": "?",
          "fire": "??",
          "water": "??",
          "soft": "?",
          "strong": "??"
        },
        "hint": "Repite la secuencia completa."
      },
      "answer": {
        "value": "yellow"
      },
      "feedback": {
        "correct": "Patron completado.",
        "incorrect": "Mira el orden desde el inicio y busca repeticion."
      },
      "reward": {
        "xp": 14,
        "stars": 12
      },
      "accessibility": {
        "spokenInstruction": true,
        "altText": "Patron interactivo"
      }
    }
  ]
}
