{
  "schemaVersion": 1,
  "id": "math-l05",
  "module": "MATHEMATICS",
  "levelNumber": 5,
  "title": "Fiesta de números gigantes",
  "status": "PUBLISHED",
  "activities": [
    {
      "id": "math-l05-a01",
      "type": "visual_count",
      "instruction": "En la fiesta hay 12 manzanas para decorar la mesa.",
      "payload": { "items": [{ "kind": "emoji", "value": "apple", "count": 12 }], "options": [10, 11, 12, 13] },
      "answer": { "value": 12 },
      "feedback": { "correct": "Exacto, la mesa tiene 12 decoraciones.", "incorrect": "Cuenta por filas para no perderte." },
      "reward": { "xp": 22, "stars": 15 },
      "accessibility": { "spokenInstruction": true, "altText": "Doce manzanas decorativas" }
    },
    {
      "id": "math-l05-a02",
      "type": "visual_count",
      "instruction": "El tren de la fiesta trae 13 manzanas. Elige el número 13.",
      "payload": { "items": [{ "kind": "emoji", "value": "apple", "count": 13 }], "options": [11, 12, 13, 14] },
      "answer": { "value": 13 },
      "feedback": { "correct": "Muy bien, llegaron 13.", "incorrect": "Separa mentalmente 10 y cuenta las que faltan." },
      "reward": { "xp": 22, "stars": 15 },
      "accessibility": { "spokenInstruction": true, "altText": "Trece manzanas en un tren imaginario" }
    },
    {
      "id": "math-l05-a03",
      "type": "visual_count",
      "instruction": "El dragón amable cuida 14 manzanas brillantes. ¿Cuántas cuida?",
      "payload": { "items": [{ "kind": "emoji", "value": "apple", "count": 14 }], "options": [12, 13, 14, 15] },
      "answer": { "value": 14 },
      "feedback": { "correct": "El dragón cuida 14 manzanas.", "incorrect": "Cuenta 10 primero y después 4 más." },
      "reward": { "xp": 24, "stars": 18 },
      "accessibility": { "spokenInstruction": true, "altText": "Catorce manzanas brillantes" }
    }
  ]
}
