{
  "schemaVersion": 1,
  "id": "art-l05",
  "module": "ART",
  "levelNumber": 5,
  "title": "Sala secreta del camaleon",
  "status": "PUBLISHED",
  "activities": [
    {
      "id": "art-l05-a01",
      "type": "pattern_completion",
      "instruction": "Abre la sala con un codigo cromatico.",
      "payload": {
        "scene": "El codigo repite sol, hoja, agua.",
        "sequence": [
          "yellow",
          "green",
          "blue",
          "yellow",
          "green",
          "?"
        ],
        "options": [
          "blue",
          "yellow",
          "red",
          "green"
        ],
        "display": {
          "1": "1",
          "2": "2",
          "3": "3",
          "4": "4",
          "5": "5",
          "6": "6",
          "7": "7",
          "8": "8",
          "9": "9",
          "10": "10",
          "red": "??",
          "yellow": "??",
          "blue": "??",
          "green": "??",
          "A": "A",
          "B": "B",
          "C": "C",
          "E": "E",
          "I": "I",
          "O": "O",
          "U": "U",
          "ma": "ma",
          "pa": "pa",
          "la": "la",
          "sa": "sa",
          "small": "S",
          "medium": "M",
          "large": "L",
          "north": "??",
          "east": "??",
          "light": "?",
          "dark": "?",
          "fire": "??",
          "water": "??",
          "soft": "?",
          "strong": "??"
        },
        "hint": "Sol-hoja-agua: amarillo-verde-azul."
      },
      "answer": {
        "value": "blue"
      },
      "feedback": {
        "correct": "Patron completado.",
        "incorrect": "Mira el orden desde el inicio y busca repeticion."
      },
      "reward": {
        "xp": 14,
        "stars": 12
      },
      "accessibility": {
        "spokenInstruction": true,
        "altText": "Patron interactivo"
      }
    },
    {
      "id": "art-l05-a02",
      "type": "paint_shape",
      "instruction": "Pinta el pincel maestro.",
      "payload": {
        "scene": "Kiko encontro un pincel que mezcla ideas.",
        "shape": "brush",
        "clue": "Pista: el primer color aprendido era del sol.",
        "colors": [
          "red",
          "yellow",
          "blue",
          "green"
        ]
      },
      "answer": {
        "color": "yellow"
      },
      "feedback": {
        "correct": "Color correcto para la pista.",
        "incorrect": "No elijas por ubicacion; piensa en la pista del mundo."
      },
      "reward": {
        "xp": 13,
        "stars": 11
      },
      "accessibility": {
        "spokenInstruction": true,
        "altText": "Figura brush"
      }
    },
    {
      "id": "art-l05-a03",
      "type": "multiple_choice",
      "instruction": "Elige el color que no pertenece al bosque.",
      "payload": {
        "scene": "La escena tiene hoja, pasto, rana y un cielo nocturno rojo.",
        "question": "Que color se siente fuera de lugar?",
        "hint": "Compara con una escena natural.",
        "options": [
          "green",
          "red",
          "blue",
          "yellow"
        ]
      },
      "answer": {
        "value": "red"
      },
      "feedback": {
        "correct": "Respuesta correcta. Usaste la pista, no solo memoria.",
        "incorrect": "Relee la pista y descarta opciones imposibles."
      },
      "reward": {
        "xp": 13,
        "stars": 11
      },
      "accessibility": {
        "spokenInstruction": true,
        "altText": "Que color se siente fuera de lugar?"
      }
    },
    {
      "id": "art-l05-a04",
      "type": "paint_shape",
      "instruction": "Pinta la nave de Kiko.",
      "payload": {
        "scene": "La nave debe perderse en el cielo.",
        "shape": "rocket",
        "clue": "Pista: cielo despejado.",
        "colors": [
          "red",
          "yellow",
          "blue",
          "green"
        ]
      },
      "answer": {
        "color": "blue"
      },
      "feedback": {
        "correct": "Color correcto para la pista.",
        "incorrect": "No elijas por ubicacion; piensa en la pista del mundo."
      },
      "reward": {
        "xp": 13,
        "stars": 11
      },
      "accessibility": {
        "spokenInstruction": true,
        "altText": "Figura rocket"
      }
    },
    {
      "id": "art-l05-a05",
      "type": "multiple_choice",
      "instruction": "Decide que color crea mas energia.",
      "payload": {
        "scene": "Kiko quiere que el cartel parezca fuerte y urgente.",
        "question": "Cual color suele sentirse mas intenso?",
        "hint": "Piensa en senales y alertas.",
        "options": [
          "red",
          "blue",
          "green",
          "yellow"
        ]
      },
      "answer": {
        "value": "red"
      },
      "feedback": {
        "correct": "Respuesta correcta. Usaste la pista, no solo memoria.",
        "incorrect": "Relee la pista y descarta opciones imposibles."
      },
      "reward": {
        "xp": 13,
        "stars": 11
      },
      "accessibility": {
        "spokenInstruction": true,
        "altText": "Cual color suele sentirse mas intenso?"
      }
    }
  ]
}
